{"details":{"accepted_ids":["section:quick-start"],"asset_ids":["asset:workflow"],"manual_edit_distance":{"changed":17,"total":100},"pattern_ids":["pattern:hero"],"rejected_ids":["asset:old"],"section_ids":["section:quick-start"]},"event":"candidate-edited","event_id":"ddcd5cf702ed9446484f1d03e087b5b564b75b42d58822cffab0abac25d1b7e5","fingerprint":"bbbbbbbbbbbbbbbbbbbbbbbbbbbbbbbbbbbbbbbbbbbbbbbbbbbbbbbbbbbbbbbb","recorded_at":"2026-08-04T12:00:00Z","run_id":"aaaaaaaaaaaaaaaaaaaaaaaaaaaaaaaaaaaaaaaaaaaaaaaaaaaaaaaaaaaaaaaa","schema_version":1}
